<?xml version="1.0"?>
<Error xmlns:xsi="http://www.w3.org/2001/XMLSchema-instance"
    xsi:noNamespaceSchemaLocation="MensajeError.xsd">
    <Info>
        <emisor>
            <IP>192.168.0.1</IP>
            <ID>1</ID>
            <tipo>tienda</tipo>
        </emisor>
        <receptor>
            <IP>192.168.0.2</IP>
            <ID>1</ID>
            <tipo>comprador</tipo>
        </receptor>
        <id>
            <ipemisor>192.168.0.2</ipemisor>
            <contador>2</contador>
        </id>
        <protocolo>compra</protocolo>
        <tipo>MError</tipo>
    </Info>
    <ID>1</ID>
    <MensajeError>
        <Texto>Faltan datos en el mensaje</Texto>
        <MensajeProv>
            <emisor>
                <IP>192.168.0.2</IP>
                <ID>1</ID>
                <tipo>comprador</tipo>
            </emisor>
            <receptor>
                <IP>192.168.0.1</IP>
                <ID>1</ID>
                <tipo>tienda</tipo>
            </receptor>
            <id>
                <ipemisor>192.168.0.2</ipemisor>
                <contador>1</contador>
            </id>
            <protocolo>compra</protocolo>
            <tipo>MCP</tipo>
        </MensajeProv>    
    </MensajeError>
</Error>